,title,manufacturer,retailer,code,link,operation,date_ops
1704,"Philips Botella Termo con Colador de acero de Agua Inteligente con Pantalla LED Táctil Inteligente con Temperatura, para Exteriores, Oficinas, Hogar",Philips,LinioMX,no-code,https://www.linio.com.mx/p/philips-botella-termo-con-colador-de-acero-de-agua-inteligente-con-pantalla-led-ta-ctil-inteligente-con-temperatura-para-exteriores-oficinas-hogar-lf2s3b#PH145HL1EAGDJLMX-669842709,Bulk marked Not In Catalog RPI,08-11-2022 13:35
1705,Audífonos Bluetooth Philips SHB3595 Controladores De 8.6mm - Negro,Philips,LinioMX,no-code,https://www.linio.com.mx/p/audi-fonos-bluetooth-philips-shb3595-controladores-de-86mm-negro-lhi88d,Bulk marked Not In Catalog RPI,08-11-2022 13:35
1706,"PHILIPS Super brillante LED Tactical Flashlights de Metal Recargable, Super Bright Flash Light, Built For Camping, Outdoors, Emergency",Philips,LinioMX,no-code,https://www.linio.com.mx/p/philips-super-brillante-led-tactical-flashlights-de-metal-recargable-super-bright-flash-light-built-for-camping-outdoors-emergency-n4ej9l#PH145SP16GLRRLMX-669837434,Bulk marked Not In Catalog RPI,08-11-2022 13:35
1707,"Philips Botella Termo de Agua Inteligente con Pantalla LED Táctil Inteligente con Temperatura, para Exteriores, Oficinas, Hogar",Philips,LinioMX,no-code,https://www.linio.com.mx/p/philips-botella-termo-de-agua-inteligente-con-pantalla-led-ta-ctil-inteligente-con-temperatura-para-exteriores-oficinas-hogar-n2m4l3#PH145HL18C4BRLMX-669842708,Bulk marked Not In Catalog RPI,08-11-2022 13:35
1708,Philips Tritan Botella de agua deportiva con tapa superior abatible a prueba de fugas sin BPA,Philips,LinioMX,no-code,https://www.linio.com.mx/p/philips-tritan-botella-de-agua-deportiva-con-tapa-superior-abatible-a-prueba-de-fugas-sin-bpa-qapz5j#PH145HL0Z4Y9BLMX-669826620,Bulk marked Not In Catalog RPI,08-11-2022 13:35
1709,2in1 Philips Botella con taza Térmica de Agua de Acero Inoxidable para Gimnasio Viaje Excursión Ciclismo,Philips,LinioMX,no-code,https://www.linio.com.mx/p/2in1-philips-botella-con-taza-te-rmica-de-agua-de-acero-inoxidable-para-gimnasio-viaje-excursio-n-ciclismo-yms4fr#PH145HL0397L3LMX-669842711,Bulk marked Not In Catalog RPI,08-11-2022 13:35
1710,Serie de Luces Philips 642972 4 juegos de 50 Micro luces 8 Funciones,Philips,LinioMX,no-code,https://www.linio.com.mx/p/serie-de-luces-philips-642972-4-juegos-de-50-micro-luces-8-funciones-orxyuh,Bulk marked Not In Catalog RPI,08-11-2022 13:35
1711,Bocina Bluetooth Philips Recargable BT100V27 Violeta,Philips,LinioMX,no-code,https://www.linio.com.mx/p/bocina-bluetooth-philips-recargable-bt100v27-violeta-lcvr8l#PH145EL1GTYC0LMX-650880824,Bulk marked Not In Catalog RPI,08-11-2022 13:35
1712,Bocina Bluetooth Philips Recargable Mod. BT200B37 Negro,Philips,LinioMX,no-code,https://www.linio.com.mx/p/bocina-bluetooth-philips-recargable-mod-bt200b37-negro-jpu9eo#PH145EL1M8AEXLMX-668037282,Bulk marked Not In Catalog RPI,08-11-2022 13:35
1713,Philips TAS3505/00 Speaker - Aluminum gray,Philips,LinioMX,no-code,https://www.linio.com.mx/p/philips-tas3505-00-speaker-aluminum-gray-n50lzb,Bulk marked Not In Catalog RPI,08-11-2022 13:35
1714,Philips TAJT60 Auriculares Bluetooth con cancelación de ruido,Philips,LinioMX,no-code,https://www.linio.com.mx/p/philips-tajt60-auriculares-bluetooth-con-cancelacio-n-de-ruido-lcorn4#PH145EL1GOUMZLMX-669732396,Bulk marked Not In Catalog RPI,08-11-2022 13:35
1715,Philips Botella de agua de acero inoxidable autolimpiante y aislada de agua UV,Philips,LinioMX,no-code,https://www.linio.com.mx/p/philips-botella-de-agua-de-acero-inoxidable-autolimpiante-y-aislada-de-agua-uv-qcjovx#PH145SP0XFI2FLMX-669739279,Bulk marked Not In Catalog RPI,08-11-2022 13:35
1716,Audífonos Bluetooth Philips SHB3595 Controladores De 8.6mm - Negro,Philips,LinioMX,no-code,https://www.linio.com.mx/p/audi-fonos-bluetooth-philips-shb3595-controladores-de-86mm-negro-yp7kkt,Bulk marked Not In Catalog RPI,08-11-2022 13:35
1717,Philips Hairclipper de corte de pelo de alto rendimiento para hombres,Philips,LinioMX,no-code,https://www.linio.com.mx/p/philips-hairclipper-de-corte-de-pelo-de-alto-rendimiento-para-hombres-v9dim7#PH145HB0HIDCNLMX-669734977,Bulk marked Not In Catalog RPI,08-11-2022 13:35
1718,Philips Depilador 8000 BRE740,Philips,LinioMX,no-code,https://www.linio.com.mx/p/philips-depilador-8000-bre740-vcxrv1,Bulk marked Not In Catalog RPI,08-11-2022 13:35
1719,Audífonos Bluetooth Philips SHB3595 Controladores De 8.6mm - Negro,Philips,LinioMX,no-code,https://www.linio.com.mx/p/audi-fonos-bluetooth-philips-shb3595-controladores-de-86mm-negro-oskx7x,Bulk marked Not In Catalog RPI,08-11-2022 13:35
1720,Nebulizador de Compresor InnoSpire Essence - Philips Respironics,Philips,LinioMX,no-code,https://www.linio.com.mx/p/nebulizador-de-compresor-innospire-essence-philips-respironics-ordo59,Deleted RPI,08-11-2022 13:39
1721,Rasuradora Aqua Touch Serie 3000 Philips 6706250 CST - Gris,Philips,LinioMX,no-code,https://www.linio.com.mx/p/rasuradora-aqua-touch-serie-3000-philips-6706250-cst-gris-wy87m0,Deleted RPI,08-11-2022 13:41
1722,Audífonos Inalámbricos Phillips Manos Libres - Tech,Philips,LinioMX,no-code,https://www.linio.com.mx/p/audi-fonos-inala-mbricos-phillips-manos-libres-tech-ve95wb,Deleted RPI,08-11-2022 13:41
1723,***Philips shaving heads HQ6 Lift & Cut 3 heads,Philips,LinioMX,HQ6/40,https://www.linio.com.mx/p/repuesto-para-rasuradora-modelo-hq640-tpdahz,Created mapping,08-11-2022 13:44
1724,Afeitadora en seco y húmedo Philips Serie 5000 S5585 / 10,Philips,LinioMX,no-code,https://www.linio.com.mx/p/afeitadora-en-seco-y-hu-medo-philips-serie-5000-s5585-10-jqmbg2,Bulk marked Not In Catalog RPI,08-11-2022 13:48
1725,Biberon Anticolico 9oz 1 cj,Philips,LinioMX,no-code,https://www.linio.com.mx/p/biberon-anticolico-9oz-1-cj-jqe4qb,Bulk marked Not In Catalog RPI,08-11-2022 13:48
1726,PHILIPS CONTROL REMOTO 4 DISPOSITIVOS,Philips,LinioMX,no-code,https://www.linio.com.mx/p/philips-control-remoto-4-dispositivos-tlv75h,Bulk marked Not In Catalog RPI,08-11-2022 13:48
1727,"Philips serie 3000 afeitadora recortadora de pelo para cejas y nariz, lavable con peine NT3650 / 16",Philips,LinioMX,no-code,https://www.linio.com.mx/p/philips-serie-3000-afeitadora-recortadora-de-pelo-para-cejas-y-nariz-lavable-con-peine-nt3650-16-rz46pe,Bulk marked Not In Catalog RPI,08-11-2022 13:48
1728,Philips - Afeitadora eléctrica en seco y húmedo Serie 5000 S5585/10,Philips,LinioMX,no-code,https://www.linio.com.mx/p/philips-afeitadora-ele-ctrica-en-seco-y-hu-medo-serie-5000-s5585-10-ju1hww,Bulk marked Not In Catalog RPI,08-11-2022 13:48
1729,Afeitadora rotativa Philips Norelco HS199 maquinilla afeitar eléctrica para hombres,Philips,LinioMX,no-code,https://www.linio.com.mx/p/afeitadora-rotativa-philips-norelco-hs199-maquinilla-afeitar-ele-ctrica-para-hombres-qc69te,Bulk marked Not In Catalog RPI,08-11-2022 13:48
1730,Micronebulizador para Nebulizador SideStream Pediátrico - Philips,Philips,LinioMX,no-code,https://www.linio.com.mx/p/micronebulizador-para-nebulizador-sidestream-pedia-trico-philips-rya3d4,Bulk marked Not In Catalog RPI,08-11-2022 13:48
1731,"Philips PQ206, Afeitadora eléctrica, Negro",Philips,LinioMX,no-code,https://www.linio.com.mx/p/philips-pq206-afeitadora-ele-ctrica-negro-s1dvby,Bulk marked Not In Catalog RPI,08-11-2022 13:48
1732,Micronebulizador para Nebulizador SideStream Adulto - Philips Respironics,Philips,LinioMX,no-code,https://www.linio.com.mx/p/micronebulizador-para-nebulizador-sidestream-adulto-philips-respironics-ve43tb,Bulk marked Not In Catalog RPI,08-11-2022 13:48
1733,Audífonos Inalámbricos Phillips Manos Libres - Tech,Philips,LinioMX,no-code,https://www.linio.com.mx/p/audi-fonos-inala-mbricos-phillips-manos-libres-tech-trb90b,Bulk marked Not In Catalog RPI,08-11-2022 13:48
1734,Filtro Desechable de CPAP DreamStation - Philips Respironics,Philips,LinioMX,no-code,https://www.linio.com.mx/p/filtro-desechable-de-cpap-dreamstation-philips-respironics-qebl19,Bulk marked Not In Catalog RPI,08-11-2022 13:48
1735,PLOGA P/COAXIAL PHILIPS C/2 PZAS.,Philips,LinioMX,no-code,https://www.linio.com.mx/p/ploga-p-coaxial-philips-c-2-pzas-oplovh,Bulk marked Not In Catalog RPI,08-11-2022 13:48
1736,Depiladora Rasuradora Afeitadora Dama Philips Satin Savage BR17050,Philips,LinioMX,no-code,https://www.linio.com.mx/p/depiladora-rasuradora-afeitadora-dama-philips-satin-savage-br17050-n501y1,Bulk marked Not In Catalog RPI,08-11-2022 13:48
1737,Concentrador De Oxígeno Everflo de 5 Litros - Philips Respironics,Philips,LinioMX,no-code,https://www.linio.com.mx/p/concentrador-de-oxi-geno-everflo-de-5-litros-philips-respironics-x0n27l,Bulk marked Not In Catalog RPI,08-11-2022 13:48
1738,SOCKET MULTITOMAS PHILIPS,Philips,LinioMX,no-code,https://www.linio.com.mx/p/socket-multitomas-philips-vdj4ec,Bulk marked Not In Catalog RPI,08-11-2022 13:48
1739,SOCKET MULTITOMAS PHILIPS,Philips,LinioMX,no-code,https://www.linio.com.mx/p/socket-multitomas-philips-s19jhe,Bulk marked Not In Catalog RPI,08-11-2022 13:48
1740,Repuestos De Cepillo De Dientes Philips Sonicare 6 Piezas,Philips,LinioMX,no-code,https://www.linio.com.mx/p/repuestos-de-cepillo-de-dientes-philips-sonicare-6-piezas-qdqpgf,Bulk marked Not In Catalog RPI,08-11-2022 13:48
1741,Rasuradora Recortadora Rastrillo Philips QP2510 Navaja,Philips,LinioMX,no-code,https://www.linio.com.mx/p/rasuradora-recortadora-rastrillo-philips-qp2510-navaja-n08luh,Bulk marked Not In Catalog RPI,08-11-2022 13:48
1742,Philips Aquatouch Shaver electrónico húmedo y seco S542004,Philips,LinioMX,no-code,https://www.linio.com.mx/p/philips-aquatouch-shaver-electro-nico-hu-medo-y-seco-s542004-s0ms0c,Bulk marked Not In Catalog RPI,08-11-2022 13:48
1743,Philips Aquatouch más rasurador eléctrico húmedo y seco AT89016,Philips,LinioMX,no-code,https://www.linio.com.mx/p/philips-aquatouch-ma-s-rasurador-ele-ctrico-hu-medo-y-seco-at89016-vbpgzw,Bulk marked Not In Catalog RPI,08-11-2022 13:48
1744,Philips Aquatouch Shaver eléctrico húmedo y seco AT60014,Philips,LinioMX,no-code,https://www.linio.com.mx/p/philips-aquatouch-shaver-ele-ctrico-hu-medo-y-seco-at60014-to64i4,Bulk marked Not In Catalog RPI,08-11-2022 13:48
1745,Rasuradora Recortadora Philips Norelco One Blade Face+body,Philips,LinioMX,no-code,https://www.linio.com.mx/p/rasuradora-recortadora-philips-norelco-one-blade-face-body-jqzh7g,Deleted RPI,08-11-2022 13:49
1746,FILTRO NONOPROTECT MODELO FY141330,Philips,LinioMX,no-code,https://www.linio.com.mx/p/filtro-nonoprotect-modelo-fy141330-lhgkss,Bulk marked Not In Catalog RPI,08-11-2022 13:55
1747,FILTRO DE AIRE MODELO FY141030,Philips,LinioMX,no-code,https://www.linio.com.mx/p/filtro-de-aire-modelo-fy141030-qbbcdw,Bulk marked Not In Catalog RPI,08-11-2022 13:55
1748,VASO REFACCION PARA VIVA BLACK MODELO HR295790,Philips,LinioMX,no-code,https://www.linio.com.mx/p/vaso-refaccion-para-viva-black-modelo-hr295790-osjgq2,Bulk marked Not In Catalog RPI,08-11-2022 13:55
1749,FILTRO ANTICAL PARA AGUA MODELO CA690310,Philips,LinioMX,no-code,https://www.linio.com.mx/p/filtro-antical-para-agua-modelo-ca690310-oqs5ei,Bulk marked Not In Catalog RPI,08-11-2022 13:55
1750,Philips Aqua Touch Shaver eléctrico húmedo y seco AT-750/16,Philips,LinioMX,no-code,https://www.linio.com.mx/p/philips-aqua-touch-shaver-ele-ctrico-hu-medo-y-seco-at-750-16-ykhtgf,Bulk marked Not In Catalog RPI,08-11-2022 13:55
1751,Auriculares inalámbricos Philips TAT2236BK00 Resistentes Negro,Philips,LinioMX,no-code,https://www.linio.com.mx/p/auriculares-inala-mbricos-philips-tat2236bk00-resistentes-negro-on6aaw,Bulk marked Not In Catalog RPI,08-11-2022 13:55
1752,Audífonos Philips inalámbricos TAT3265BK/97 internos verdaderos,Philips,LinioMX,no-code,https://www.linio.com.mx/p/audi-fonos-philips-inala-mbricos-tat3265bk-97-internos-verdaderos-s30g4e,Bulk marked Not In Catalog RPI,08-11-2022 13:55
1753,AUDIFONOS BT COLOR NEGRO MARCA PHILIPS,Philips,LinioMX,no-code,https://www.linio.com.mx/p/audifonos-bt-color-negro-marca-philips-tr6hp6,Bulk marked Not In Catalog RPI,08-11-2022 13:55
1754,Philips Aquatouch Electric Shaver húmedo y seco AT610/14,Philips,LinioMX,no-code,https://www.linio.com.mx/p/philips-aquatouch-electric-shaver-hu-medo-y-seco-at610-14-wwygyn,Bulk marked Not In Catalog RPI,08-11-2022 13:55
1755,Philips Mouse Inalámbrico + Pad Mouse,Philips,LinioMX,no-code,https://www.linio.com.mx/p/philips-mouse-inala-mbrico-pad-mouse-ymyx2q#PH145EL03KIW4LMX-650485141,Bulk marked Not In Catalog RPI,08-11-2022 13:55
1756,Philips Rasuradora Aquatouch Series 5000 Modelo 6691870 COS,Philips,LinioMX,no-code,https://www.linio.com.mx/p/philips-rasuradora-aquatouch-series-5000-modelo-6691870-cos-s1fbu8,Bulk marked Not In Catalog RPI,08-11-2022 13:55
1757,Bocina Bluetooth Philips Recargable BT100P27 Rosa,Philips,LinioMX,no-code,https://www.linio.com.mx/p/bocina-bluetooth-philips-recargable-bt100p27-rosa-jpceqt#PH145EL1MSADSLMX-650880825,Bulk marked Not In Catalog RPI,08-11-2022 13:55
1758,Inspirometro Threshold IMT HS730-10 - Philips Respironics,Philips,LinioMX,no-code,https://www.linio.com.mx/p/inspirometro-threshold-imt-hs730-10-philips-respironics-vbxcwy,Bulk marked Not In Catalog RPI,08-11-2022 13:55
1759,Bocina Bluetooth Philips Recargable BT100P27 Rosa,Philips,LinioMX,no-code,https://www.linio.com.mx/p/bocina-bluetooth-philips-recargable-bt100p27-rosa-mzuiyb#PH145EL1B6901LMX-665055079,Bulk marked Not In Catalog RPI,08-11-2022 13:55
1760,Audífonos Philips SHS3200BK37 Con Gancho Flexible Para Oreja,Philips,LinioMX,no-code,https://www.linio.com.mx/p/audi-fonos-philips-shs3200bk37-con-gancho-flexible-para-oreja-osvffn#PH145EL108HD7LMX-632175434,Bulk marked Not In Catalog RPI,08-11-2022 13:55
1761,Philips Mouse Inalámbrico + Pad Mouse,Philips,LinioMX,no-code,https://www.linio.com.mx/p/philips-mouse-inala-mbrico-pad-mouse-ypwzvs#PH145EL004BWTLMX-635474935,Bulk marked Not In Catalog RPI,08-11-2022 13:55
1762,Kit Teclado y Mouse Philips C501 Inalámbrico Español,Philips,LinioMX,no-code,https://www.linio.com.mx/p/kit-teclado-y-mouse-philips-c501-inala-mbrico-espan-ol-vdop24#PH145EL0D61BHLMX-665258551,Bulk marked Not In Catalog RPI,08-11-2022 13:55
1763,"PHILIPS Combo de Teclado inalámbrico y Mouse 2.4 GHz, Nano Receptor USB, tamaño Completo",Philips,LinioMX,no-code,https://www.linio.com.mx/p/philips-combo-de-teclado-inala-mbrico-y-mouse-24-ghz-nano-receptor-usb-taman-o-completo-qd5rmg#PH145EL0WYI95LMX-668493190,Bulk marked Not In Catalog RPI,08-11-2022 13:55
1764,Philips Mouse Inalámbrico + Pad Mouse,Philips,LinioMX,no-code,https://www.linio.com.mx/p/philips-mouse-inala-mbrico-pad-mouse-wzfkky#PH145EL09IUXWLMX-650485142,Bulk marked Not In Catalog RPI,08-11-2022 13:55
1765,Tope Para Piso Redondo Cromado 49-C Phillips,Philips,LinioMX,no-code,https://www.linio.com.mx/p/tope-para-piso-redondo-cromado-49-c-phillips-yoznc8#PH070HL79ZTSLMX-1286136,Marked RPI as hidden,08-11-2022 13:58
1766,"CABLE LIGHTNING, MICRO USB Y CABLE TIPO C, BLANCO",Philips,LinioMX,no-code,https://www.linio.com.mx/p/cable-lightning-micro-usb-y-cable-tipo-c-blanco-ldqn78#PH145EL1G87NVLMX-628514191,Bulk marked Not In Catalog RPI,08-11-2022 14:01
1767,"CABLE LIGHTNING, MICRO USB Y CABLE TIPO C, NEGRO",Philips,LinioMX,no-code,https://www.linio.com.mx/p/cable-lightning-micro-usb-y-cable-tipo-c-negro-tnfdo4#PH145EL0MGJEZLMX-628514186,Bulk marked Not In Catalog RPI,08-11-2022 14:01
1768,Philips Mouse Inalámbrico + Pad Mouse,Philips,LinioMX,no-code,https://www.linio.com.mx/p/philips-mouse-inala-mbrico-pad-mouse-x2dne0#PH145EL062NYLLMX-635474936,Bulk marked Not In Catalog RPI,08-11-2022 14:01
1769,Philips Mouse Inalámbrico + Pad Mouse,Philips,LinioMX,no-code,https://www.linio.com.mx/p/philips-mouse-inala-mbrico-pad-mouse-ynj9go#PH145EL02I2BXLMX-635474975,Bulk marked Not In Catalog RPI,08-11-2022 14:01
1770,Philips Norelco 3000 Recortadora Barba Delineadora 13 piezas,Philips,LinioMX,no-code,https://www.linio.com.mx/p/philips-norelco-3000-recortadora-barba-delineadora-13-piezas-ypoldy#PH145HB00WLX5LMX-627029882,Bulk marked Not In Catalog RPI,08-11-2022 14:01
1771,Philips Zoom NiteWhite ACP Whitening Gel 16% - 6 jeringas,Philips,LinioMX,no-code,https://www.linio.com.mx/p/philips-zoom-nitewhite-acp-whitening-gel-16-6-jeringas-wyuiy0#PH145HB0A2JW3LMX-634114618,Bulk marked Not In Catalog RPI,08-11-2022 14:01
1772,Philips Zoom DayWhite ACP Whitening Gel 14% 6 jeringas,Philips,LinioMX,no-code,https://www.linio.com.mx/p/philips-zoom-daywhite-acp-whitening-gel-14-6-jeringas-tnrtyg#PH145HB0LZ7ZNLMX-634114619,Bulk marked Not In Catalog RPI,08-11-2022 14:01
1773,Philips Mouse Inalámbrico + Pad Mouse,Philips,LinioMX,no-code,https://www.linio.com.mx/p/philips-mouse-inala-mbrico-pad-mouse-jrq88i#PH145EL1KK3QCLMX-650485140,Bulk marked Not In Catalog RPI,08-11-2022 14:01
1774,Philips HY1100 One Battery Toothbrush by Sonicare Negro,Philips,LinioMX,no-code,https://www.linio.com.mx/p/philips-hy1100-one-battery-toothbrush-by-sonicare-negro-rzl0e9#PH145HB0SK203LMX-667340095,Bulk marked Not In Catalog RPI,08-11-2022 14:01
1775,Audífonos Philips SHS3200BK37 Con Gancho Flexible Para Oreja,Philips,LinioMX,no-code,https://www.linio.com.mx/p/audi-fonos-philips-shs3200bk37-con-gancho-flexible-para-oreja-onstgj#PH145EL14VOUKLMX-179757377,Bulk marked Not In Catalog RPI,08-11-2022 14:01
1776,Kit Teclado y Mouse Philips C501 Inalámbrico Español,Philips,LinioMX,no-code,https://www.linio.com.mx/p/kit-teclado-y-mouse-philips-c501-inala-mbrico-espan-ol-jtip7g#PH145EL1I8Y25LMX-665258548,Bulk marked Not In Catalog RPI,08-11-2022 14:01
1777,Philips Zoom Daywhite ACP Whitening Gel 14% 3 jeringas,Philips,LinioMX,no-code,https://www.linio.com.mx/p/philips-zoom-daywhite-acp-whitening-gel-14-3-jeringas-ynkqnc#PH145HB02XCMRLMX-634114593,Bulk marked Not In Catalog RPI,08-11-2022 14:01
1778,Philips Zoom NiteWhite ACP Whitening Gel 22% 6 jeringas,Philips,LinioMX,no-code,https://www.linio.com.mx/p/philips-zoom-nitewhite-acp-whitening-gel-22-6-jeringas-vci1ns#PH145HB0EU0QBLMX-634114595,Bulk marked Not In Catalog RPI,08-11-2022 14:01
1779,Philips-Norelco-Maquina-Recortadora-Barba-Bigote-Delineadora,Philips,LinioMX,no-code,https://www.linio.com.mx/p/philips-norelco-maquina-recortadora-barba-bigote-delineadora-vaekox#PH145HB0H5VAFLMX-658186335,Bulk marked Not In Catalog RPI,08-11-2022 14:01
1780,5 Piezas de Bombillos Led PHILIPS 9290020558-Blanco,Philips,LinioMX,no-code,https://www.linio.com.mx/p/5-piezas-de-bombillos-led-philips-9290020558-blanco-ylorqm,Deleted RPI,08-11-2022 14:26
1781,Bocina Portatil Bluetooth PHILIPS TAS350500 Gris,Philips,LinioMX,no-code,https://www.linio.com.mx/p/bocina-portatil-bluetooth-philips-tas350500-gris-wxj5lz,Deleted RPI,08-11-2022 14:27
1782,Bocina Inalambica Philips TAS750500 Bluetooth Negro,Philips,LinioMX,no-code,https://www.linio.com.mx/p/bocina-inalambica-philips-tas750500-bluetooth-negro-yp8ik5,Deleted RPI,08-11-2022 14:28
1783,Audífonos Philips SHB3595BK10 Bluetooth Negro,Philips,LinioMX,no-code,https://www.linio.com.mx/p/audi-fonos-philips-shb3595bk10-bluetooth-negro-jp81a7,Deleted RPI,08-11-2022 14:29
1784,Philips Aquatouch Shaver eléctrico húmedo y seco AT600/14,Philips,LinioMX,no-code,https://www.linio.com.mx/p/philips-aquatouch-shaver-ele-ctrico-hu-medo-y-seco-at600-14-qatapb,Bulk marked Not In Catalog RPI,08-11-2022 14:30
1785,Philips Zoom NiteWhite ACP 22% Whitening Gel 3 jeringas,Philips,LinioMX,no-code,https://www.linio.com.mx/p/philips-zoom-nitewhite-acp-22-whitening-gel-3-jeringas-vbb6g8#PH145HB0G0VXVLMX-634114617,Bulk marked Not In Catalog RPI,08-11-2022 14:30
1786,Philips Aquatouch Shaver electrónico húmedo y seco S5420/04,Philips,LinioMX,no-code,https://www.linio.com.mx/p/philips-aquatouch-shaver-electro-nico-hu-medo-y-seco-s5420-04-mzqlpr,Bulk marked Not In Catalog RPI,08-11-2022 14:30
1787,Mascarilla Oronasal para CPAP Amara Gel de Adulto - Philips Respironics,Philips,LinioMX,no-code,https://www.linio.com.mx/p/mascarilla-oronasal-para-cpap-amara-gel-de-adulto-philips-respironics-orid3k#PH145HB11AT3JLMX-665796681,Bulk marked Not In Catalog RPI,08-11-2022 14:30
1788,PHILIPS CORTADORA DE CABELLO,Philips,LinioMX,no-code,https://www.linio.com.mx/p/philips-cortadora-de-cabello-onaule#PH145HB15N847LMX-667257687,Bulk marked Not In Catalog RPI,08-11-2022 14:30
1789,Mascarilla Oronasal para CPAP Amara Gel de Adulto - Philips Respironics,Philips,LinioMX,no-code,https://www.linio.com.mx/p/mascarilla-oronasal-para-cpap-amara-gel-de-adulto-philips-respironics-orid3k#PH145HB11AT3JLMX-665796678,Bulk marked Not In Catalog RPI,08-11-2022 14:30
1790,Philips Aquatouch más rasurador eléctrico húmedo y seco AT890/16,Philips,LinioMX,no-code,https://www.linio.com.mx/p/philips-aquatouch-ma-s-rasurador-ele-ctrico-hu-medo-y-seco-at890-16-lc797z,Bulk marked Not In Catalog RPI,08-11-2022 14:30
1791,Philips-Norelco-Maquina-Recortadora-Barba-Bigote-Delineadora,Philips,LinioMX,no-code,https://www.linio.com.mx/p/philips-norelco-maquina-recortadora-barba-bigote-delineadora-ooyye8#PH145HB13CWPDLMX-639798441,Bulk marked Not In Catalog RPI,08-11-2022 14:30
1792,PHILIPS CORTADORA COLOR NEGRO,Philips,LinioMX,no-code,https://www.linio.com.mx/p/philips-cortadora-color-negro-qbfmoy#PH145HB0Z3GGNLMX-667257676,Bulk marked Not In Catalog RPI,08-11-2022 14:30
1793,Mascarilla Oronasal para CPAP Amara Gel de Adulto - Philips Respironics,Philips,LinioMX,no-code,https://www.linio.com.mx/p/mascarilla-oronasal-para-cpap-amara-gel-de-adulto-philips-respironics-orid3k#PH145HB11AT3JLMX-665796679,Bulk marked Not In Catalog RPI,08-11-2022 14:30
1794,Bisagra B Arquitectónicas PHILIPS B Arq con baleros Hierro 3 - Negro,Philips,LinioMX,no-code,https://www.linio.com.mx/p/bisagra-b-arquitecto-nicas-philips-b-arq-con-baleros-hierro-3-negro-s1x46c,Bulk marked Not In Catalog RPI,08-11-2022 14:30
1795,Philips Aqua Touch Shaver eléctrico húmedo y seco AT-750/16,Philips,LinioMX,no-code,https://www.linio.com.mx/p/philips-aqua-touch-shaver-ele-ctrico-hu-medo-y-seco-at-750-16-jonwq7,Bulk marked Not In Catalog RPI,08-11-2022 14:30
1796,Recortadora Ergonómica De Nariz Lavable Philips Norelco Nose,Philips,LinioMX,no-code,https://www.linio.com.mx/p/recortadora-ergono-mica-de-nariz-lavable-philips-norelco-nose-tqnivu,Bulk marked Not In Catalog RPI,08-11-2022 14:30
1797,Philips Colgate Cepillo De Dientes Eléctrico Sonicpro COS,Philips,LinioMX,no-code,https://www.linio.com.mx/p/philips-colgate-cepillo-de-dientes-ele-ctrico-sonicpro-cos-jswn5z,Bulk marked Not In Catalog RPI,08-11-2022 14:30
1798,Bisagra B Arquitectónicas PHILIPS B Arq con baleros Hierro 4 - Negro,Philips,LinioMX,no-code,https://www.linio.com.mx/p/bisagra-b-arquitecto-nicas-philips-b-arq-con-baleros-hierro-4-negro-opnjzs,Bulk marked Not In Catalog RPI,08-11-2022 14:30
1799,5 Piezas de Bombillos Led PHILIPS 9290012664-Blanco,Philips,LinioMX,no-code,https://www.linio.com.mx/p/5-piezas-de-bombillos-led-philips-9290012664-blanco-jqg2we,Bulk marked Not In Catalog RPI,08-11-2022 14:30
1800,Bocina Philips TAS5505/00 RMS 20 W,Philips,LinioMX,no-code,https://www.linio.com.mx/p/bocina-philips-tas5505-00-rms-20-w-wzww0j,Bulk marked Not In Catalog RPI,08-11-2022 14:30
1801,"Philips Brilliance 258B6QUEB 25"" LED LCD Monitor - 16:9 - 5 ms",Philips,LinioMX,no-code,https://www.linio.com.mx/p/philips-brilliance-258b6queb-25-led-lcd-monitor-16-9-5-ms-vdku5c,Bulk marked Not In Catalog RPI,08-11-2022 14:30
1802,Bocina Inalambica Philips TAS1505B00 Bluetooth Negro,Philips,LinioMX,no-code,https://www.linio.com.mx/p/bocina-inalambica-philips-tas1505b00-bluetooth-negro-lc6bbj,Bulk marked Not In Catalog RPI,08-11-2022 14:30
1803,Sistema de Terapia Auto CPAP Dreamstation 2 Advanced - Philips,Philips,LinioMX,no-code,https://www.linio.com.mx/p/sistema-de-terapia-auto-cpap-dreamstation-2-advanced-philips-yptwlj,Bulk marked Not In Catalog RPI,08-11-2022 14:30
1804,Philips HC3689 Cortapelos Azul Claro,Philips,LinioMX,no-code,https://www.linio.com.mx/p/philips-hc3689-cortapelos-azul-claro-mzqcgx,Bulk marked Not In Catalog RPI,08-11-2022 14:40
1805,Philips Aquatouch Electric Shaver húmedo y seco AT610/14,Philips,LinioMX,no-code,https://www.linio.com.mx/p/philips-aquatouch-electric-shaver-hu-medo-y-seco-at610-14-on9y7j,Bulk marked Not In Catalog RPI,08-11-2022 14:40
1806,Bocina Philips Tas350500 Bluetoothusb Resistente Al Agua,Philips,LinioMX,no-code,https://www.linio.com.mx/p/bocina-philips-tas350500-bluetoothusb-resistente-al-agua-vbrle5,Bulk marked Not In Catalog RPI,08-11-2022 14:40
1807,Philips HC3688 Cortapelos Azul,Philips,LinioMX,no-code,https://www.linio.com.mx/p/philips-hc3688-cortapelos-azul-valy5d,Bulk marked Not In Catalog RPI,08-11-2022 14:40
1808,Philips HY1100 One Battery Toothbrush by Sonicare ROJO,Philips,LinioMX,no-code,https://www.linio.com.mx/p/philips-hy1100-one-battery-toothbrush-by-sonicare-rojo-to9lio,Bulk marked Not In Catalog RPI,08-11-2022 14:40
1809,Philips HR2957/90 Jarra Para Licuadora Plástica KNIVES UNIT,Philips,LinioMX,no-code,https://www.linio.com.mx/p/philips-hr2957-90-jarra-para-licuadora-pla-stica-knives-unit-rzz6qd,Bulk marked Not In Catalog RPI,08-11-2022 14:40
1810,Philips HY1100 One Battery Toothbrush by Sonicare Cian-Azul,Philips,LinioMX,no-code,https://www.linio.com.mx/p/philips-hy1100-one-battery-toothbrush-by-sonicare-cian-azul-lf6ank,Bulk marked Not In Catalog RPI,08-11-2022 14:40
1811,Philips HY1100 One Battery Toothbrush by Sonicare AMARILLO,Philips,LinioMX,no-code,https://www.linio.com.mx/p/philips-hy1100-one-battery-toothbrush-by-sonicare-amarillo-lekv1s,Bulk marked Not In Catalog RPI,08-11-2022 14:40
1812,Philips S3103 Afeitadora Eléctrica IPX7 A Prueba De Agua Cabezal,Philips,LinioMX,no-code,https://www.linio.com.mx/p/philips-s3103-afeitadora-ele-ctrica-ipx7-a-prueba-de-agua-cabezal-ldglye,Bulk marked Not In Catalog RPI,08-11-2022 14:40
1813,Filtro de carbón activado,Philips,LinioMX,no-code,https://www.linio.com.mx/p/filtro-de-carbo-n-activado-le0abk,Bulk marked Not In Catalog RPI,08-11-2022 14:40
