,title,manufacturer,retailer,code,link,operation,date_ops
0,"Secador de pelo Philips Serie 3000, 2100W, cuidado iónico, difusor y boquilla estrecha",Philips,ElCorteIngles,no-code,https://www.elcorteingles.es/electrodomesticos/A45051195-secador-de-pelo-philips-serie-3000-2100w-cuidado-ionico-difusor-y-boquilla-estrecha/,RPI Re-added to Retailer,07-11-2022 12:20
1,Radio de coche Ce235Bt Philips,Philips,ElCorteIngles,no-code,https://www.elcorteingles.es/taller-mecanico/MP_0013038_4895185631417-radio-de-coche-ce235bt-philips/,RPI Re-added to Retailer,07-11-2022 12:20
2,Intercomunicador Philips Avent audio,Philips,ElCorteIngles,no-code,https://www.elcorteingles.es/bebes/A45349066-intercomunicador-philips-avent-audio/,RPI Re-added to Retailer,07-11-2022 12:20
3,"Depiladora de luz pulsada Philips Lumea Advanced IPL, 2 cabezales, depilación mujer en cara y cuerpo con sensor de piel",Philips,ElCorteIngles,no-code,https://www.elcorteingles.es/electrodomesticos/A17349890-depiladora-de-luz-pulsada-philips-lumea-advanced-ipl-2-cabezales-depilacion-mujer-en-cara-y-cuerpo-con-sensor-de-piel/,RPI Re-added to Retailer,07-11-2022 12:20
4,"Depiladora de luz pulsada Philips Lumea Advanced IPL, 1 cabezal, depilación corporal mujer con sensor de tono de piel. Incluye recortador facial",Philips,ElCorteIngles,no-code,https://www.elcorteingles.es/electrodomesticos/A43492703-depiladora-de-luz-pulsada-philips-lumea-advanced-ipl-1-cabezal-depilacion-corporal-mujer-con-sensor-de-tono-de-piel-incluye-recortador-facial/,RPI Re-added to Retailer,07-11-2022 12:20
5,"Depiladora de luz pulsada Philips Lumea Serie 9000, uso sin cable, 3 cabezales, depilación en casa, mujer y hombre, sensor de piel inteligente",Philips,ElCorteIngles,no-code,https://www.elcorteingles.es/electrodomesticos/A38970495-depiladora-de-luz-pulsada-philips-lumea-serie-9000-uso-sin-cable-3-cabezales-depilacion-en-casa-mujer-y-hombre-sensor-de-piel-inteligente/,RPI Re-added to Retailer,07-11-2022 12:20
6,Juego de altavoces de coche Csp6911 300W 6X9 Philips,Philips,ElCorteIngles,no-code,https://www.elcorteingles.es/taller-mecanico/MP_0013038_6923410721119-juego-de-altavoces-de-coche-csp6911-300w-6x9-philips/,RPI Re-added to Retailer,07-11-2022 12:20
7,Pack 10 CD-R Audio Philips 700 MB,Philips,ElCorteIngles,no-code,https://www.elcorteingles.es/electronica/A19287808-pack-10-cd-r-audio-philips-700-mb/,RPI Re-added to Retailer,07-11-2022 12:20
8,"Memoria USB - Philips - Memoria USB 16 GB, USB 2.0",Philips,ElCorteIngles,no-code,https://www.elcorteingles.es/electronica/MP_0008431_FM16FD00B00-memoria-usb-philips--memoria-usb-16-gb-usb-20/,RPI Re-added to Retailer,07-11-2022 12:20
9,"Cafetera espresso superautomática Philips EP3226/40 con espumador de leche, 4 tipos de café",Philips,ElCorteIngles,no-code,https://www.elcorteingles.es/electrodomesticos/A45038066-cafetera-espresso-superautomatica-philips-ep322640-con-espumador-de-leche-4-tipos-de-cafe/,RPI Re-added to Retailer,07-11-2022 12:20
10,"TV OLED 165 cm (65"") Philips 65OLED865/12 UHD 4K con Inteligencia Artificial, Ambilight 3, Android TV (Reacondicionado grado A)",Philips,ElCorteIngles,no-code,https://www.elcorteingles.es/electronica/A45169824-tv-oled-165-cm-65-philips-65oled86512-uhd-4k-con-inteligencia-artificial-ambilight-3-android-tv-reacondicionado-grado-a/,RPI Re-added to Retailer,07-11-2022 12:20
11,"Pack 3 bombillas Philips Hue White Ambiance 10,5W E27 + puente + mando inalámbrico",Philips,ElCorteIngles,no-code,https://www.elcorteingles.es/electronica/A40939807-pack-3-bombillas-philips-hue-white-ambiance-105w-e27--puente--mando-inalambrico/,RPI Re-added to Retailer,07-11-2022 12:20
12,"Cafetera espresso superautomática Philips EP820/00 con espumador de leche, 2 tipos de café",Philips,ElCorteIngles,no-code,https://www.elcorteingles.es/electrodomesticos/A44675801-cafetera-espresso-superautomatica-philips-ep82000-con-espumador-de-leche-2-tipos-de-cafe/,RPI Re-added to Retailer,07-11-2022 12:20
13,"Bombilla LED con Sensor Crepuscular E27 7,5 W 806 lm 2.700 K",Philips,ElCorteIngles,no-code,https://www.elcorteingles.es/bricor/A30905105-bombilla-led-con-sensor-crepuscular-e27-75-w-806-lm-2700-k/,RPI Re-added to Retailer,07-11-2022 12:20
14,"Bombilla LED Regulable E27 7,2 W 1055 lm 2700 K",Philips,ElCorteIngles,no-code,https://www.elcorteingles.es/bricor/A22411881-bombilla-led-regulable-e27-72-w-1055-lm-2700-k/,RPI Re-added to Retailer,07-11-2022 12:20
15,"Bombilla LED reflector regulable E27 4,5W 345 lm 2.700K",Philips,ElCorteIngles,no-code,https://www.elcorteingles.es/bricor/A22411876-bombilla-led-reflector-regulable-e27-45w-345-lm-2700k/,RPI Re-added to Retailer,07-11-2022 12:20
16,Lámpara suelo Philips Gradient Signe Blanco,Philips,ElCorteIngles,no-code,https://www.elcorteingles.es/electronica/A42562582-lampara-suelo-philips-gradient-signe-blanco/,RPI Re-added to Retailer,07-11-2022 12:20
17,"Monitor PC 60 cm (24"") Philips 241V8L, 75 Hz, Full HD, AdaptiveSync, LowBlue Light (Reacondicionado grado A)",Philips,ElCorteIngles,no-code,https://www.elcorteingles.es/electronica/A44966131-monitor-pc-60-cm-24-philips-241v8l-75-hz-full-hd-adaptivesync-lowblue-light-reacondicionado-grado-a/,RPI Re-added to Retailer,07-11-2022 12:20
18,Plafón cuadrado para exterior Skies Philips,Philips,ElCorteIngles,no-code,https://www.elcorteingles.es/hogar/A15951177-plafon-cuadrado-para-exterior-skies-philips/,RPI Re-added to Retailer,07-11-2022 12:20
19,"Bombilla LED esférica E27 4,3 W 470 lm 2.700 K",Philips,ElCorteIngles,no-code,https://www.elcorteingles.es/bricor/A37955529-bombilla-led-esferica-e27-43-w-470-lm-2700-k/,RPI Re-added to Retailer,07-11-2022 12:20
20,Barbero Philips series 3000 con 20 ajustes de longitud,Philips,ElCorteIngles,no-code,https://www.elcorteingles.es/electrodomesticos/A41654268-barbero-philips-series-3000-con-20-ajustes-de-longitud/,RPI Re-added to Retailer,07-11-2022 12:20
21,Auricular de botón Philips Con Micro Azul,Philips,ElCorteIngles,no-code,https://www.elcorteingles.es/electronica/MP_0000572_6925970709408-auricular-de-boton-philips-con-micro-azul/,RPI Re-added to Retailer,07-11-2022 12:20
22,Lámpara suelo Philips Gradient Signe Negro,Philips,ElCorteIngles,no-code,https://www.elcorteingles.es/electronica/A42562604-lampara-suelo-philips-gradient-signe-negro/,RPI Re-added to Retailer,07-11-2022 12:20
23,Tubo LED inteligente Play gradient grande Negro,Philips,ElCorteIngles,no-code,https://www.elcorteingles.es/electronica/A42562536-tubo-led-inteligente-play-gradient-grande-negro/,RPI Re-added to Retailer,07-11-2022 12:20
24,Tubo LED inteligente Play gradient grande Blanco,Philips,ElCorteIngles,no-code,https://www.elcorteingles.es/electronica/A42562533-tubo-led-inteligente-play-gradient-grande-blanco/,RPI Re-added to Retailer,07-11-2022 12:20
25,Tubo LED inteligente Philips Play gradient compact Blanco,Philips,ElCorteIngles,no-code,https://www.elcorteingles.es/electronica/A42562494-tubo-led-inteligente-philips-play-gradient-compact-blanco/,RPI Re-added to Retailer,07-11-2022 12:20
26,Bombilla LED estándar E27 13W 1.521lm 4.000K - Pack 3 Uds,Philips,ElCorteIngles,no-code,https://www.elcorteingles.es/bricor/A36032902-bombilla-led-estandar-e27-13w-1521lm-4000k-pack-3-uds/,RPI Re-added to Retailer,07-11-2022 12:20
27,Bombilla LED estándar E27 13W 1.521lm 2.700K - Pack 3 Uds,Philips,ElCorteIngles,no-code,https://www.elcorteingles.es/bricor/A36032900-bombilla-led-estandar-e27-13w-1521lm-2700k-pack-3-uds/,RPI Re-added to Retailer,07-11-2022 12:20
28,Plancha para el pelo profesional Philips HPS930/40,Philips,ElCorteIngles,no-code,https://www.elcorteingles.es/electrodomesticos/MP_0391854_HPS930-plancha-para-el-pelo-profesional-philips-hps93040/,RPI Re-added to Retailer,07-11-2022 12:20
29,Bómbilla de coche H7 55w 1 cool blue intense Phillips Phillips,Philips,ElCorteIngles,no-code,https://www.elcorteingles.es/taller-mecanico/MP_0013038_4008321651563-bombilla-de-coche-h7-55w-1-cool-blue-intense-phillips-phillips/,RPI Re-added to Retailer,07-11-2022 12:20
30,Lámpara de coche H7 55w 1 cool blue intense Phillips,Philips,ElCorteIngles,no-code,https://www.elcorteingles.es/taller-mecanico/MP_0013038_4008321651563-lampara-de-coche-h7-55w-1-cool-blue-intense-phillips/,RPI Re-added to Retailer,07-11-2022 12:20
31,Plancha de pelo Philips Essential Serie 3000 con tecnología ThermoProtect y placas cerámicas,Philips,ElCorteIngles,no-code,https://www.elcorteingles.es/electrodomesticos/A41654269-plancha-de-pelo-philips-essential-serie-3000-con-tecnologia-thermoprotect-y-placas-ceramicas/,RPI Re-added to Retailer,07-11-2022 12:20
32,Plafón LED redondo Moire 20W 2300lm 4000K,Philips,ElCorteIngles,no-code,https://www.elcorteingles.es/bricor/A40563516-plafon-led-redondo-moire-20w-2300lm-4000k/,RPI Re-added to Retailer,07-11-2022 12:20
33,Bombilla LED deco filamento G200 5 W 2000 K,Philips,ElCorteIngles,no-code,https://www.elcorteingles.es/bricor/A42746414-bombilla-led-deco-filamento-g200-5-w-2000-k/,RPI Re-added to Retailer,07-11-2022 12:20
34,"Bombilla LED Standard Philips 7,5W. E27",Philips,ElCorteIngles,no-code,https://www.elcorteingles.es/hogar/A17812095-bombilla-led-standard-philips-75w-e27/,RPI Re-added to Retailer,07-11-2022 12:20
35,Pack de 3 bombillas LED estándar E27 8 W 806 lm 2.700 K,Philips,ElCorteIngles,no-code,https://www.elcorteingles.es/bricor/A36032897-pack-de-3-bombillas-led-estandar-e27-8-w-806-lm-2700-k/,RPI Re-added to Retailer,07-11-2022 12:20
36,Pack de 3 bombillas LED estándar E27 8 W 806 lm 4.000 K,Philips,ElCorteIngles,no-code,https://www.elcorteingles.es/bricor/A36032894-pack-de-3-bombillas-led-estandar-e27-8-w-806-lm-4000-k/,RPI Re-added to Retailer,07-11-2022 12:20
37,"Pack de 3 empotrables LED 4,5 W 380 lm 2700 K",Philips,ElCorteIngles,no-code,https://www.elcorteingles.es/bricor/A40563224-pack-de-3-empotrables-led-45-w-380-lm-2700-k/,RPI Re-added to Retailer,07-11-2022 12:20
38,"Pack de 3 bombillas LED vela E14 5,5W 470lm",Philips,ElCorteIngles,no-code,https://www.elcorteingles.es/bricor/A36032898-pack-de-3-bombillas-led-vela-e14-55w-470lm/,RPI Re-added to Retailer,07-11-2022 12:20
39,"Pack 3 empotrables LED 4,5 W 380 lm 2700 K",Philips,ElCorteIngles,no-code,https://www.elcorteingles.es/bricor/A40563225-pack-3-empotrables-led-45-w-380-lm-2700-k/,RPI Re-added to Retailer,07-11-2022 12:20
40,Bombilla LED Globo Claro 8W E27 Philips,Philips,ElCorteIngles,no-code,https://www.elcorteingles.es/hogar/A19675653-bombilla-led-globo-claro-8w-e27-philips/,RPI Re-added to Retailer,07-11-2022 12:20
41,Tubo LED inteligente Philips Play gradient compact Negro,Philips,ElCorteIngles,no-code,https://www.elcorteingles.es/electronica/A42562503-tubo-led-inteligente-philips-play-gradient-compact-negro/,RPI Re-added to Retailer,07-11-2022 12:20
42,Lámpara de mesa Philips Gradient Signe Negro,Philips,ElCorteIngles,no-code,https://www.elcorteingles.es/electronica/A42562552-lampara-de-mesa-philips-gradient-signe-negro/,RPI Re-added to Retailer,07-11-2022 12:20
43,Bombilla LED deco filamento A60 4 W 1800 K,Philips,ElCorteIngles,no-code,https://www.elcorteingles.es/bricor/A42746404-bombilla-led-deco-filamento-a60-4-w-1800-k/,RPI Re-added to Retailer,07-11-2022 12:20
44,"Afeitadora corporal Philips Serie 3000, recorta y afeita, uso en seco y húmedo",Philips,ElCorteIngles,no-code,https://www.elcorteingles.es/electrodomesticos/A26034165-afeitadora-corporal-philips-serie-3000-recorta-y-afeita-uso-en-seco-y-humedo/,RPI Re-added to Retailer,07-11-2022 12:20
45,"Bombilla Philips Hue White&Color 4,3 W GU10",Philips,ElCorteIngles,no-code,https://www.elcorteingles.es/electronica/A40938183-bombilla-philips-hue-white-and-color-43-w-gu10/,RPI Re-added to Retailer,07-11-2022 12:20
46,Bombilla LED Classic Clara 6 W. E27 Philips,Philips,ElCorteIngles,no-code,https://www.elcorteingles.es/hogar/A19675641-bombilla-led-classic-clara-6-w-e27-philips/,RPI Re-added to Retailer,07-11-2022 12:20
47,"Kit de inicio Philips Hue White and Color Ambiance E27 (3 bombillas, puente Hue y un mando)",Philips,ElCorteIngles,no-code,https://www.elcorteingles.es/electronica/A40938164-kit-de-inicio-philips-hue-white-and-color-ambiance-e27-3-bombillas-puente-hue-y-un-mando/,RPI Re-added to Retailer,07-11-2022 12:20
48,Pendrive 2 en 1 Philips 64 GB USB y USB C,Philips,ElCorteIngles,no-code,https://www.elcorteingles.es/electronica/A43398724-pendrive-2-en-1-philips-64-gb-usb-y-usb-c/,RPI Re-added to Retailer,07-11-2022 12:20
49,Timbre sin cables welcomebell,Philips,ElCorteIngles,no-code,https://www.elcorteingles.es/bricor/A43006160-timbre-sin-cables-welcomebell/,RPI Re-added to Retailer,07-11-2022 12:20
50,Timbre sin cables welcomebell,Philips,ElCorteIngles,no-code,https://www.elcorteingles.es/bricor/A43006159-timbre-sin-cables-welcomebell/,RPI Re-added to Retailer,07-11-2022 12:20
51,Downlight LED redondo empotrable 17 W 1600 lm,Philips,ElCorteIngles,no-code,https://www.elcorteingles.es/bricor/A40563228-downlight-led-redondo-empotrable-17-w-1600-lm/,RPI Re-added to Retailer,07-11-2022 12:20
52,Plafón cuadrado para exterior Philips Skies,Philips,ElCorteIngles,no-code,https://www.elcorteingles.es/hogar/A15951177-plafon-cuadrado-para-exterior-philips-skies/,RPI Re-added to Retailer,07-11-2022 12:20
53,"Pack 2 bombillas Philips Hue White&Color 10,5W E27",Philips,ElCorteIngles,no-code,https://www.elcorteingles.es/electronica/A40938182-pack-2-bombillas-philips-hue-white-and-color-105w-e27/,RPI Re-added to Retailer,07-11-2022 12:20
54,Bombilla LED Philips Hue White and Color Ambiance Vela E14,Philips,ElCorteIngles,no-code,https://www.elcorteingles.es/electronica/A40938189-bombilla-led-philips-hue-white-and-color-ambiance-vela-e14/,RPI Re-added to Retailer,07-11-2022 12:20
55,Bombilla Philips Hue White&Color 10.5W A60 E27,Philips,ElCorteIngles,no-code,https://www.elcorteingles.es/electronica/A40938175-bombilla-philips-hue-white-and-color-105w-a60-e27/,RPI Re-added to Retailer,07-11-2022 12:20
56,"Bombilla LED deco filamento vela 2,5 W 1800 K",Philips,ElCorteIngles,no-code,https://www.elcorteingles.es/bricor/A42748338-bombilla-led-deco-filamento-vela-25-w-1800-k/,RPI Re-added to Retailer,07-11-2022 12:20
57,"Bombilla LED deco filamento esférica 2,6 W 1800 K",Philips,ElCorteIngles,no-code,https://www.elcorteingles.es/bricor/A42746405-bombilla-led-deco-filamento-esferica-26-w-1800-k/,RPI Re-added to Retailer,07-11-2022 12:20
58,Bombilla LED deco filamento Edison 4 W 1800 K,Philips,ElCorteIngles,no-code,https://www.elcorteingles.es/bricor/A42746412-bombilla-led-deco-filamento-edison-4-w-1800-k/,RPI Re-added to Retailer,07-11-2022 12:20
59,Extensión de tira LED Philips Gradient Lightstrip 1 metro,Philips,ElCorteIngles,no-code,https://www.elcorteingles.es/electronica/A42562611-extension-de-tira-led-philips-gradient-lightstrip-1-metro/,RPI Re-added to Retailer,07-11-2022 12:20
60,Lámpara de mesa Philips Gradient Signe Blanco,Philips,ElCorteIngles,no-code,https://www.elcorteingles.es/electronica/A42562548-lampara-de-mesa-philips-gradient-signe-blanco/,RPI Re-added to Retailer,07-11-2022 12:20
61,Interruptor de pared Philips Hue pack de 2,Philips,ElCorteIngles,no-code,https://www.elcorteingles.es/electronica/A42562493-interruptor-de-pared-philips-hue-pack-de-2/,RPI Re-added to Retailer,07-11-2022 12:20
62,Interruptor de pared Philips Hue,Philips,ElCorteIngles,no-code,https://www.elcorteingles.es/electronica/A42562491-interruptor-de-pared-philips-hue/,RPI Re-added to Retailer,07-11-2022 12:20
63,"Bombilla Philips Hue White and Color Ambiance 13,5W A67 E27",Philips,ElCorteIngles,no-code,https://www.elcorteingles.es/electronica/A42562484-bombilla-philips-hue-white-and-color-ambiance-135w-a67-e27/,RPI Re-added to Retailer,07-11-2022 12:20
64,Bombilla Philips Hue White Ambiance 13W A67 E27,Philips,ElCorteIngles,no-code,https://www.elcorteingles.es/electronica/A42562469-bombilla-philips-hue-white-ambiance-13w-a67-e27/,RPI Re-added to Retailer,07-11-2022 12:20
65,Tira LED Philips Gradient Lightstrip Kit Básico 2 metros,Philips,ElCorteIngles,no-code,https://www.elcorteingles.es/electronica/A42562608-tira-led-philips-gradient-lightstrip-kit-basico-2-metros/,RPI Re-added to Retailer,07-11-2022 12:20
66,Plafón LED redondo 12 W SHAN 40K,Philips,ElCorteIngles,no-code,https://www.elcorteingles.es/bricor/A40563524-plafon-led-redondo-12-w-shan-40k/,RPI Re-added to Retailer,07-11-2022 12:20
67,Chupete Philips Avent Anatómico Ultra Air silicona (6 - 18 M.) 2 unids. 'I Love Papa' verde/azul,Philips,ElCorteIngles,no-code,https://www.elcorteingles.es/bebes/A39435015-chupete-philips-avent-anatomico-ultra-air-silicona-6-18-m-2-unids-i-love-papa-verdeazul/,RPI Re-added to Retailer,07-11-2022 12:20
68,"Bombilla LED dicroica GU10 6,2W 575lm 2.700K",Philips,ElCorteIngles,no-code,https://www.elcorteingles.es/bricor/A37955552-bombilla-led-dicroica-gu10-62w-575lm-2700k/,RPI Re-added to Retailer,07-11-2022 12:20
69,"Bombilla LED vela 6,5 W 806 lm",Philips,ElCorteIngles,no-code,https://www.elcorteingles.es/bricor/A37955551-bombilla-led-vela-65-w-806-lm/,RPI Re-added to Retailer,07-11-2022 12:20
70,"Bombilla LED esférica E14 6,5W 806 lm 2.700K",Philips,ElCorteIngles,no-code,https://www.elcorteingles.es/bricor/A37955550-bombilla-led-esferica-e14-65w-806-lm-2700k/,RPI Re-added to Retailer,07-11-2022 12:20
71,"Bombilla LED esférica E14 4,3W 470lm 2.700K",Philips,ElCorteIngles,no-code,https://www.elcorteingles.es/bricor/A37955547-bombilla-led-esferica-e14-43w-470lm-2700k/,RPI Re-added to Retailer,07-11-2022 12:20
72,"Bombilla LED vela E14 2,2 W 250 lm",Philips,ElCorteIngles,no-code,https://www.elcorteingles.es/bricor/A37955541-bombilla-led-vela-e14-22-w-250-lm/,RPI Re-added to Retailer,07-11-2022 12:20
73,"Bombilla LED vela 4,3 W 470 lm",Philips,ElCorteIngles,no-code,https://www.elcorteingles.es/bricor/A37955530-bombilla-led-vela-43-w-470-lm/,RPI Re-added to Retailer,07-11-2022 12:20
74,"Bombilla LED dicroica GU5,3 7W 621lm 2.700K",Philips,ElCorteIngles,no-code,https://www.elcorteingles.es/bricor/A28250741-bombilla-led-dicroica-gu53-7w-621lm-2700k/,RPI Re-added to Retailer,07-11-2022 12:20
75,"Bombilla LED dicroica GU5,3 7W 660 lm 4.000 K",Philips,ElCorteIngles,no-code,https://www.elcorteingles.es/bricor/A28250742-bombilla-led-dicroica-gu53-7w-660-lm-4000-k/,RPI Re-added to Retailer,07-11-2022 12:20
76,"Bombilla LED dicroica GU10 4,9W 485lm 4.000K",Philips,ElCorteIngles,no-code,https://www.elcorteingles.es/bricor/A28250747-bombilla-led-dicroica-gu10-49w-485lm-4000k/,RPI Re-added to Retailer,07-11-2022 12:20
77,"Bombilla LED cápsula G9 3,2W 400lm 3.000K",Philips,ElCorteIngles,no-code,https://www.elcorteingles.es/bricor/A28250748-bombilla-led-capsula-g9-32w-400lm-3000k/,RPI Re-added to Retailer,07-11-2022 12:20
78,"Bombilla LED globo E27 16,5W 1.521lm 2.700K",Philips,ElCorteIngles,no-code,https://www.elcorteingles.es/bricor/A30032594-bombilla-led-globo-e27-165w-1521lm-2700k/,RPI Re-added to Retailer,07-11-2022 12:20
79,"Bombilla LED cápsula G4 1,8W 215lm 3.000K",Philips,ElCorteIngles,no-code,https://www.elcorteingles.es/bricor/A30032597-bombilla-led-capsula-g4-18w-215lm-3000k/,RPI Re-added to Retailer,07-11-2022 12:20
80,Luz LED lineal regulable R7S 14W,Philips,ElCorteIngles,no-code,https://www.elcorteingles.es/bricor/A30032609-luz-led-lineal-regulable-r7s-14w/,RPI Re-added to Retailer,07-11-2022 12:20
81,"Bombilla LED Estándar E27 10,5W 1.521lm 6.500K",Philips,ElCorteIngles,no-code,https://www.elcorteingles.es/bricor/A30032611-bombilla-led-estandar-e27-105w-1521lm-6500k/,RPI Re-added to Retailer,07-11-2022 12:20
82,"Bombilla LED dicroica GU10 4,6W 390 lm 6.500K",Philips,ElCorteIngles,no-code,https://www.elcorteingles.es/bricor/A30032612-bombilla-led-dicroica-gu10-46w-390-lm-6500k/,RPI Re-added to Retailer,07-11-2022 12:20
83,"Bombilla LED PL G24D 8,5W",Philips,ElCorteIngles,no-code,https://www.elcorteingles.es/bricor/A30905104-bombilla-led-pl-g24d-85w/,RPI Re-added to Retailer,07-11-2022 12:20
84,"Bombilla LED con Sensor Crepuscular E27 7,5W 806lm 2.700K",Philips,ElCorteIngles,no-code,https://www.elcorteingles.es/bricor/A30905105-bombilla-led-con-sensor-crepuscular-e27-75w-806lm-2700k/,RPI Re-added to Retailer,07-11-2022 12:20
85,Plafón LED redondo Moire 6W 450lm 3000K,Philips,ElCorteIngles,no-code,https://www.elcorteingles.es/bricor/A31629969-plafon-led-redondo-moire-6w-450lm-3000k/,RPI Re-added to Retailer,07-11-2022 12:20
86,Plafón LED redondo Moire 17W 1700lm 2700K,Philips,ElCorteIngles,no-code,https://www.elcorteingles.es/bricor/A31629973-plafon-led-redondo-moire-17w-1700lm-2700k/,RPI Re-added to Retailer,07-11-2022 12:20
87,Plafón LED redondo Moire 10W 850lm 4000K,Philips,ElCorteIngles,no-code,https://www.elcorteingles.es/bricor/A31629974-plafon-led-redondo-moire-10w-850lm-4000k/,RPI Re-added to Retailer,07-11-2022 12:20
88,Plafón LED redondo Moire 6W 450lm 4000K,Philips,ElCorteIngles,no-code,https://www.elcorteingles.es/bricor/A31629975-plafon-led-redondo-moire-6w-450lm-4000k/,RPI Re-added to Retailer,07-11-2022 12:20
89,"Bombilla LED globo E27 10,5 W 1.521lm 2.700K",Philips,ElCorteIngles,no-code,https://www.elcorteingles.es/bricor/A37955528-bombilla-led-globo-e27-105-w-1521lm-2700k/,RPI Re-added to Retailer,07-11-2022 12:20
90,"Bombilla LED esférica E27 4,3W 470lm 2.700K",Philips,ElCorteIngles,no-code,https://www.elcorteingles.es/bricor/A37955529-bombilla-led-esferica-e27-43w-470lm-2700k/,RPI Re-added to Retailer,07-11-2022 12:20
91,"Bombilla LED estándar regulable E27 10,5W 1.521lm 2.700K",Philips,ElCorteIngles,no-code,https://www.elcorteingles.es/bricor/A30032593-bombilla-led-estandar-regulable-e27-105w-1521lm-2700k/,RPI Re-added to Retailer,07-11-2022 12:20
92,"Bombilla LED vela mate 4,3 W 470 lm 4000 K",Philips,ElCorteIngles,no-code,https://www.elcorteingles.es/bricor/A30032607-bombilla-led-vela-mate-43-w-470-lm-4000-k/,RPI Re-added to Retailer,07-11-2022 12:20
93,Videoportero Welcome Eye Connect,Philips,ElCorteIngles,no-code,https://www.elcorteingles.es/bricor/A37953029-videoportero-welcome-eye-connect/,RPI Re-added to Retailer,07-11-2022 12:20
94,Bombilla LED Classic Globo 13 W Philips,Philips,ElCorteIngles,no-code,https://www.elcorteingles.es/hogar/A38553350-bombilla-led-classic-globo-13-w-philips/,RPI Re-added to Retailer,07-11-2022 12:20
95,Bombilla Halógena especial hornos E14 15W 90lm,Philips,ElCorteIngles,no-code,https://www.elcorteingles.es/bricor/A22411810-bombilla-halogena-especial-hornos-e14-15w-90lm/,RPI Re-added to Retailer,07-11-2022 12:20
96,Bombilla Halógena especial frigorífico E14 15W 110lm,Philips,ElCorteIngles,no-code,https://www.elcorteingles.es/bricor/A22411814-bombilla-halogena-especial-frigorifico-e14-15w-110lm/,RPI Re-added to Retailer,07-11-2022 12:20
97,"Bombilla LED reflector E14 2,8W 210lm 2.700K",Philips,ElCorteIngles,no-code,https://www.elcorteingles.es/bricor/A22411863-bombilla-led-reflector-e14-28w-210lm-2700k/,RPI Re-added to Retailer,07-11-2022 12:20
98,Bombilla LED vela E14 6W,Philips,ElCorteIngles,no-code,https://www.elcorteingles.es/bricor/A22411872-bombilla-led-vela-e14-6w/,RPI Re-added to Retailer,07-11-2022 12:20
99,"Bombilla LED Regulable E27 7,5 W 1055 lm 2700 K",Philips,ElCorteIngles,no-code,https://www.elcorteingles.es/bricor/A22411881-bombilla-led-regulable-e27-75-w-1055-lm-2700-k/,RPI Re-added to Retailer,07-11-2022 12:20
100,"Bombilla LED GU10 4,6W",Philips,ElCorteIngles,no-code,https://www.elcorteingles.es/bricor/A22411885-bombilla-led-gu10-46w/,RPI Re-added to Retailer,07-11-2022 12:20
101,Bombilla LED globo E27 7W 806lm 2.700K,Philips,ElCorteIngles,no-code,https://www.elcorteingles.es/bricor/A22411890-bombilla-led-globo-e27-7w-806lm-2700k/,RPI Re-added to Retailer,07-11-2022 12:20
102,Tubo LED T8 10 W G13 20W,Philips,ElCorteIngles,no-code,https://www.elcorteingles.es/bricor/A22411894-tubo-led-t8-10-w-g13-20w/,RPI Re-added to Retailer,07-11-2022 12:20
103,Bombilla LED estándar E27 13 W 2.000 lm 2.700K,Philips,ElCorteIngles,no-code,https://www.elcorteingles.es/bricor/A24508793-bombilla-led-estandar-e27-13-w-2000-lm-2700k/,RPI Re-added to Retailer,07-11-2022 12:20
104,Bombilla LED estándar E27 13W 2.000lm 4.000K,Philips,ElCorteIngles,no-code,https://www.elcorteingles.es/bricor/A24508794-bombilla-led-estandar-e27-13w-2000lm-4000k/,RPI Re-added to Retailer,07-11-2022 12:20
105,"Bombilla LED Estándar E27 10,5W 1.521lm 2.700K",Philips,ElCorteIngles,no-code,https://www.elcorteingles.es/bricor/A25549962-bombilla-led-estandar-e27-105w-1521lm-2700k/,RPI Re-added to Retailer,07-11-2022 12:20
106,Estaca de exterior Puled,Philips,ElCorteIngles,no-code,https://www.elcorteingles.es/bricor/A25751756-estaca-de-exterior-puled/,RPI Re-added to Retailer,07-11-2022 12:20
107,"Bombilla LED reflector regulable E27 4,5W 345lm 2.700K",Philips,ElCorteIngles,no-code,https://www.elcorteingles.es/bricor/A22411876-bombilla-led-reflector-regulable-e27-45w-345lm-2700k/,RPI Re-added to Retailer,07-11-2022 12:20
108,Plafón LED redondo 10 W ZARPY 40K,Philips,ElCorteIngles,no-code,https://www.elcorteingles.es/bricor/A40563512-plafon-led-redondo-10-w-zarpy-40k/,RPI Re-added to Retailer,07-11-2022 12:20
109,Tubo LED T8 10 W G13 10W,Philips,ElCorteIngles,no-code,https://www.elcorteingles.es/bricor/A22411865-tubo-led-t8-10-w-g13-10w/,RPI Re-added to Retailer,07-11-2022 12:20
110,Downlight LED superficie redondo 18 W 1700 lm BCO,Philips,ElCorteIngles,no-code,https://www.elcorteingles.es/bricor/A40563230-downlight-led-superficie-redondo-18-w-1700-lm-bco/,RPI Re-added to Retailer,07-11-2022 12:20
111,Tira de luz LED INTEGRADO 5 m 21 W con mando Philips,Philips,ElCorteIngles,no-code,https://www.elcorteingles.es/hogar/A38553360-tira-de-luz-led-integrado-5-m-21-w-con-mando-philips/,RPI Re-added to Retailer,07-11-2022 12:20
112,Tira de luz LED INTEGRADO 2 m 11W Philips,Philips,ElCorteIngles,no-code,https://www.elcorteingles.es/hogar/A38553356-tira-de-luz-led-integrado-2-m-11w-philips/,RPI Re-added to Retailer,07-11-2022 12:20
